{
  "schemaVersion": 1,
  "checkId": "test/cli.test.ts",
  "command": "scan",
  "fixture": "test/cli.test.ts",
  "environment": "local",
  "provider": null,
  "service": null,
  "startedAt": "1970-01-01T00:00:00.000Z",
  "endedAt": "1970-01-01T00:00:00.000Z",
  "outcome": "pass",
  "commit": "aaaaaaaaaaaaaaaaaaaaaaaaaaaaaaaaaaaaaaaa",
  "npmDigest": "bbbbbbbbbbbbbbbbbbbbbbbbbbbbbbbbbbbbbbbbbbbbbbbbbbbbbbbbbbbbbbbb",
  "actionDigest": null,
  "workflowRun": null,
  "logDigest": "cccccccccccccccccccccccccccccccccccccccccccccccccccccccccccccccc"
}
