{
  "schemaVersion": 1,
  "checkId": "test/cli.test.ts",
  "command": "scan",
  "fixture": "local-scan",
  "environment": "local",
  "provider": null,
  "service": null,
  "startedAt": "2026-08-27T14:00:00.000Z",
  "endedAt": "2026-08-27T14:00:01.000Z",
  "outcome": "pass",
  "commit": "aaaaaaaaaaaaaaaaaaaaaaaaaaaaaaaaaaaaaaaa",
  "npmDigest": "dddddddddddddddddddddddddddddddddddddddddddddddddddddddddddddddd",
  "actionDigest": null,
  "workflowRun": null,
  "logDigest": "cccccccccccccccccccccccccccccccccccccccccccccccccccccccccccccccc"
}
